{
  "nodes": [
    {
      "id": "__start__",
      "kind": "start"
    },
    {
      "id": "fetch",
      "kind": "node",
      "stage": "intake",
      "row": "in"
    },
    {
      "id": "parse",
      "kind": "node",
      "stage": "read",
      "row": "in"
    },
    {
      "id": "validate",
      "kind": "node",
      "stage": "check",
      "row": "fix"
    },
    {
      "id": "retry",
      "kind": "node",
      "stage": "repair",
      "row": "fix"
    },
    {
      "id": "store",
      "kind": "node",
      "stage": "deliver",
      "row": "out"
    },
    {
      "id": "__end__",
      "kind": "end"
    }
  ],
  "edges": [
    {
      "source": "__start__",
      "target": "fetch",
      "conditional": false,
      "branch": null
    },
    {
      "source": "fetch",
      "target": "parse",
      "conditional": false,
      "branch": null
    },
    {
      "source": "parse",
      "target": "validate",
      "conditional": false,
      "branch": null
    },
    {
      "source": "validate",
      "target": "store",
      "conditional": true,
      "branch": "valid"
    },
    {
      "source": "validate",
      "target": "retry",
      "conditional": true,
      "branch": "invalid"
    },
    {
      "source": "retry",
      "target": "fetch",
      "conditional": false,
      "branch": null
    },
    {
      "source": "store",
      "target": "__end__",
      "conditional": false,
      "branch": null
    }
  ],
  "stages": [
    {
      "id": "intake",
      "number": 1,
      "name": "Bring it in",
      "question": "Where does the data come from?",
      "description": "Fetch the raw pages."
    },
    {
      "id": "read",
      "number": 2,
      "name": "Make sense of it",
      "question": "What is in each page?",
      "description": "Parse the pages into records."
    },
    {
      "id": "check",
      "number": 3,
      "name": "Check it",
      "question": "Is every record valid?",
      "description": "Validate each record."
    },
    {
      "id": "repair",
      "number": 4,
      "name": "Fix what failed",
      "question": "Can the bad ones be saved?",
      "description": "Retry the invalid records."
    },
    {
      "id": "deliver",
      "number": 5,
      "name": "Hand it over",
      "question": "Where does it end up?",
      "description": "Store the records."
    },
    {
      "id": "archive",
      "number": 6,
      "name": "Keep a copy",
      "question": "Is anything archived?",
      "description": "Archive the records."
    }
  ],
  "loop": {
    "fit": "intake",
    "choose": "read"
  },
  "notes": {
    "general": "A note with <b>markup</b> and <script>alert(1)</script> that must show as plain text.",
    "stages": {
      "check": "<i>Check</i> carefully.",
      "archive": "Nothing is archived in this pipeline."
    }
  },
  "items": [
    {
      "id": "seed",
      "label": "seed data loader",
      "stage": "intake",
      "before": "fetch",
      "summary": {
        "text": "<b>Loaded</b> before the run.",
        "rows": [
          {
            "label": "Rows",
            "value": "<script>x</script>"
          }
        ],
        "link": {
          "label": "Read the docs",
          "href": "#docs"
        }
      }
    },
    {
      "id": "ext",
      "label": "external reference",
      "stage": "intake",
      "before": "fetch",
      "summary": {
        "text": "Kept elsewhere.",
        "link": {
          "label": "Elsewhere",
          "href": "http://example.com/"
        }
      }
    }
  ],
  "rows": [
    {
      "id": "in",
      "title": "Bring it in",
      "note": "the first pass"
    },
    {
      "id": "fix",
      "title": "Check and fix",
      "note": "repeats until every record is valid"
    },
    {
      "id": "out",
      "title": "Hand it over",
      "note": ""
    }
  ]
}
